{
  "schemaVersion": "1.0",
  "lastVerified": "2026-07-14",
  "program": {
    "id": "starlight-autonomous-product-foundry",
    "name": "Starlight Autonomous Product Foundry",
    "owner": "FrankX",
    "canonicalRepo": "frankxai/agentic-business-os",
    "thesis": "Convert proven workflows into verified agent-delivered products without making founder implementation hours the fulfillment model.",
    "commercialRule": "Sell outcomes, entitlements, service credits, updates, recurring operators, and explicitly agreed partner rights only after the autonomy gate passes."
  },
  "observedState": {
    "asOf": "2026-07-14",
    "vercelAgentRunProjectsLast30Days": 0,
    "runtimeClaim": "design-only",
    "ppAdmission": "held",
    "queueDispatched": false,
    "evidence": [
      "Read-only Vercel Agent Runs inspection returned no production projects for the preceding 30 days.",
      "pp preflight --workload swarm returned HOLD because free RAM, CPU load, and Codex runtime count exceeded the swarm contract."
    ]
  },
  "autonomyLevels": [
    {
      "id": "L0",
      "name": "discovered",
      "description": "A workflow, bespoke implementation, or concept without repeatable agent fulfillment.",
      "publicPaidEligible": false,
      "ownUseLicenseEligible": false,
      "resaleLicenseEligible": false,
      "recurringEligible": false
    },
    {
      "id": "L1",
      "name": "packaged-assisted",
      "description": "A skill, plugin, template, or pack exists, but setup or support still depends on expert help.",
      "publicPaidEligible": false,
      "ownUseLicenseEligible": false,
      "resaleLicenseEligible": false,
      "recurringEligible": false
    },
    {
      "id": "L2",
      "name": "agent-delivered-beta",
      "description": "An agent creates and validates the artifact while a human handles exceptions and studies failures.",
      "publicPaidEligible": true,
      "ownUseLicenseEligible": false,
      "resaleLicenseEligible": false,
      "recurringEligible": false
    },
    {
      "id": "L3",
      "name": "self-serve-commercial",
      "description": "Checkout or grant through verified first win works without Frank on the happy path.",
      "publicPaidEligible": true,
      "ownUseLicenseEligible": true,
      "resaleLicenseEligible": false,
      "recurringEligible": false
    },
    {
      "id": "L4",
      "name": "autonomous-recurring-operator",
      "description": "Recurring execution, metering, support, recovery, and renewal are agent-run within policy.",
      "publicPaidEligible": true,
      "ownUseLicenseEligible": true,
      "resaleLicenseEligible": false,
      "recurringEligible": true
    },
    {
      "id": "L5",
      "name": "partner-scale-system",
      "description": "Multiple operators, attribution, updates, independent verification, and partner governance are proven.",
      "publicPaidEligible": true,
      "ownUseLicenseEligible": true,
      "resaleLicenseEligible": true,
      "recurringEligible": true
    }
  ],
  "licenseGate": {
    "minimumOwnUseLevel": "L3",
    "minimumRecurringLevel": "L4",
    "minimumResaleLevel": "L5",
    "requirements": [
      "A second user activates without Frank.",
      "The happy path requires no founder setup or support.",
      "Evaluation, privacy, claims, and security checks pass.",
      "Entitlement grant, revoke, expiry, refund, and recovery are tested.",
      "Agent writes are least-privilege, reversible, and receipted.",
      "Cost estimates, credit caps, settlement, and failed-run behavior are visible.",
      "Support automation resolves known issues and escalates unknown exceptions.",
      "Version, provenance, changelog, update path, and rollback are verified.",
      "Commercial terms and rights have named human approval."
    ]
  },
  "products": [
    {
      "id": "agentic-business-os-open",
      "name": "Open Foundry / Agentic Business OS",
      "kind": "open-substrate",
      "audience": ["founder", "domain operator", "creator", "agency", "small team"],
      "outcome": "Inspect, fork, and own a governed starting point for one AI-enabled business workflow.",
      "ownerSurface": "frankxai/agentic-business-os",
      "experienceSurface": "https://www.frankx.ai/foundry",
      "maturity": "live",
      "autonomyLevel": "L1",
      "claimStatus": "verified",
      "revenueStreams": [],
      "commerce": { "provider": "none", "mode": "free", "status": "not-applicable" },
      "entitlement": { "type": "public", "status": "verified" },
      "credits": { "enabled": false, "policyId": null },
      "delivery": { "mode": "public-github", "status": "verified" },
      "runtime": { "target": "none", "status": "not-applicable" },
      "support": { "mode": "documentation", "status": "documented" },
      "proof": [
        "Open repository, template, packs, validators, and tagged releases exist.",
        "Existing template typecheck and build evidence is recorded in the v1 Foundry registry."
      ],
      "nextGate": "Forward-test the autonomous product router and expose current autonomy truth without implying a hosted agent fleet.",
      "humanGates": ["public_claims", "brand_identity"]
    },
    {
      "id": "ai-native-business-pathfinder",
      "name": "AI-Native Business Pathfinder Pack",
      "kind": "skill-pack",
      "audience": ["founder", "domain operator", "creator", "agency", "small team"],
      "outcome": "Select one buyer, one workflow, one architecture, and one seven-day proof.",
      "ownerSurface": "frankxai/agentic-business-os",
      "experienceSurface": null,
      "maturity": "prototype",
      "autonomyLevel": "L1",
      "claimStatus": "partial",
      "revenueStreams": [],
      "commerce": { "provider": "none", "mode": "free", "status": "not-applicable" },
      "entitlement": { "type": "public", "status": "verified" },
      "credits": { "enabled": false, "policyId": null },
      "delivery": { "mode": "public-github", "status": "verified" },
      "runtime": { "target": "local-skill", "status": "packaged-only" },
      "support": { "mode": "documentation", "status": "documented" },
      "proof": [
        "Portable SKILL.md pack, route matrix, and seven-day proof template exist.",
        "One blind restart-route forward test passed on 2026-07-10."
      ],
      "nextGate": "Complete four additional route tests and compile it into a hosted recommendation agent only after runtime admission.",
      "humanGates": ["public_claims"]
    },
    {
      "id": "starlight-proof-pack",
      "name": "Starlight Proof Pack",
      "kind": "starlight-pack",
      "audience": ["domain operator", "creator", "agency"],
      "outcome": "Install one versioned capability with evals, provenance, update route, and a verified first result.",
      "ownerSurface": "frankxai/agentic-business-os",
      "experienceSurface": "frankx-foundry",
      "maturity": "proposed",
      "autonomyLevel": "L1",
      "claimStatus": "unverified",
      "revenueStreams": ["one-time", "update-pass"],
      "commerce": { "provider": "undecided", "mode": "one-time", "status": "not-configured" },
      "entitlement": { "type": "release-access", "status": "design-only" },
      "credits": { "enabled": false, "policyId": null },
      "delivery": { "mode": "signed-archive-or-private-github", "status": "not-verified" },
      "runtime": { "target": "plugin-or-skill-installer", "status": "design-only" },
      "support": { "mode": "agent-first", "status": "proposed" },
      "proof": [],
      "nextGate": "Select one low-risk pack, verify five no-founder activations, and test revoke, update, and rollback before checkout.",
      "humanGates": ["billing", "pricing", "license_terms", "public_claims"]
    },
    {
      "id": "pathfinder-agent-app",
      "name": "Pathfinder Outcome Agent",
      "kind": "agent-app",
      "audience": ["founder", "domain operator", "creator", "agency", "small team"],
      "outcome": "Turn an approved workflow description into one product blueprint, proof plan, and activation route.",
      "ownerSurface": "future-foundry-runtime",
      "experienceSurface": "frankx-foundry",
      "maturity": "proposed",
      "autonomyLevel": "L0",
      "claimStatus": "unverified",
      "revenueStreams": ["subscription", "service-credits"],
      "commerce": { "provider": "undecided", "mode": "freemium", "status": "not-configured" },
      "entitlement": { "type": "workspace-and-credits", "status": "design-only" },
      "credits": { "enabled": true, "policyId": "activation" },
      "delivery": { "mode": "hosted-vercel-app", "status": "not-verified" },
      "runtime": { "target": "eve-or-workflowagent", "status": "design-only" },
      "support": { "mode": "agent-first", "status": "proposed" },
      "proof": [],
      "nextGate": "Read version-matched runtime docs, implement a preview with fixtures, and pass five route evals plus five second-user activations.",
      "humanGates": ["production", "secrets", "billing", "spend", "public_claims"]
    },
    {
      "id": "autonomous-product-builder",
      "name": "Autonomous Product Builder",
      "kind": "agent-swarm-pack",
      "audience": ["verified founder", "selected collaborator", "internal product operator"],
      "outcome": "Generate a scoped skill, plugin, pack, or app candidate with tests, evidence, and release packet in an isolated worktree.",
      "ownerSurface": "starlight-queen-and-foundry",
      "experienceSurface": "private-operator-console",
      "maturity": "proposed",
      "autonomyLevel": "L0",
      "claimStatus": "unverified",
      "revenueStreams": ["service-credits", "subscription"],
      "commerce": { "provider": "none", "mode": "internal", "status": "not-applicable" },
      "entitlement": { "type": "invitation-and-workspace-policy", "status": "design-only" },
      "credits": { "enabled": true, "policyId": "operator-monthly" },
      "delivery": { "mode": "isolated-git-worktree", "status": "not-verified" },